Recipe Title,Recipe URL,Recipe Video,Cutlery,Container,Glass,
Orange Cauliflower “Chicken”,https://tasty.co/recipe/orange-cauliflower-chicken,86,fork,bowl,,
Hasselback Butternut Squash,https://tasty.co/recipe/hasselback-butternut-squash,40,"fork, knife",plate,,
Swedish Sticky Chocolate Cake (Kladdkaka),https://tasty.co/recipe/swedish-sticky-chocolate-cake-kladdkaka,38,fork,plate,,
Slow Cooker Chicken Fajita Bowls,https://tasty.co/recipe/slow-cooker-chicken-fajita-bowls,37,fork,plate/bolw,,{spoon: “shown at the end putting sauce e.g. guacamole on the plate”}
Portobello Fajita Bowl Meal Prep,https://tasty.co/recipe/portobello-fajita-bowl-meal-prep,2,fork,plate,,{cut: “the last 14 seconds are just Tasty logos (abspanne)”}
Thai Coconut Vegetable Curry,https://tasty.co/recipe/thai-coconut-vegetable-curry,1,spoon,,,{cut: “no container in last 14 sec”}
One-Pan Miso Honey Salmon For Two,https://tasty.co/recipe/one-pan-miso-honey-salmon-for-two,0,fork,plate,,
Meal Prep Chicken Burrito Bowls,https://tasty.co/recipe/meal-prep-chicken-burrito-bowls,13,fork,,,{container: “food-container shown”}
Cashew Chicken Stir-Fry,https://tasty.co/recipe/cashew-chicken-stir-fry,7,chopsticks,plate/bowl,,{cutlery: “lepel shown before as serving”}
Weekday Meal-Prep Chicken Burrito Bowls,https://tasty.co/recipe/weekday-meal-prep-chicken-burrito-bowls,16,fork,plate,,{container: “food container shown”}
Vegetarian Grain Bowl Meal Prep,https://tasty.co/recipe/vegetarian-grain-bowl-meal-prep,5,fork,bowl,,{food-container: “bowl was actually food-container”}
Roasted Brussels Sprouts Salad,https://tasty.co/recipe/roasted-brussels-sprouts-salad,10,fork,bowl,,
Slow Cooker Steak and Veggies,https://tasty.co/recipe/slow-cooker-steak-and-veggies,6,,,,
Garlic Parmesan Bacon Brussels Sprouts,https://tasty.co/recipe/garlic-parmesan-bacon-brussels-sprouts,11,,,,
Easy Honey-Mustard Chicken Meal Prep,https://tasty.co/recipe/easy-honey-mustard-chicken-meal-prep,12,,,,
One-Pan Winter Chicken Roast,https://tasty.co/recipe/one-pan-autumn-chicken-roast,14,,,,
Roasted Garlic Parmesan Brussels Sprouts,https://tasty.co/recipe/roasted-garlic-parmesan-brussels-sprouts,19,,,,
One-pan Honey Garlic Chicken,https://tasty.co/recipe/one-pan-honey-garlic-chicken,18,,,,
Cookies and Cream Cheesecake Cookies,https://tasty.co/recipe/cookies-and-cream-cheesecake-cookies,20,,,,
One Bowl Chocolate Chip Banana Bread,https://tasty.co/recipe/one-bowl-chocolate-chip-banana-bread,27,,,,
Chocolate Chip Cookies,https://tasty.co/recipe/chocolate-chip-cookies,21,,,,
Creamy Garlic Parmesan Crispy Chicken Salad,https://tasty.co/recipe/creamy-garlic-parmesan-crispy-chicken-salad,24,,,,
Classic Yellow Cake,https://tasty.co/recipe/classic-yellow-cake,26,,,,
The Ultimate Waffle,https://tasty.co/recipe/the-ultimate-waffle,25,,,,
Cheddar Biscuit Chicken Pot Pie,https://tasty.co/recipe/cheddar-biscuit-chicken-pot-pie,28,,,,
Cheddar Ranch Popcorn Chicken,https://tasty.co/recipe/cheddar-ranch-popcorn-chicken,33,,,,
Lemon-Berry Muffins,https://tasty.co/recipe/lemon-berry-muffins,29,,,,
The Ultimate Funfetti Cake,https://tasty.co/recipe/the-ultimate-funfetti-cake,30,,,,
Cheddar Ranch Chicken Strips,https://tasty.co/recipe/cheddar-ranch-chicken-strips,48,,,,
Flakiest Biscuits By Angie Thomas,https://tasty.co/recipe/flakiest-biscuits,39,,,,
Whole30 Coconut Curry Meal Prep,https://tasty.co/recipe/whole30-coconut-curry-meal-prep,32,,,,
Roasted Butternut Squash Soup,https://tasty.co/recipe/roasted-butternut-squash-soup,34,,,,
Fall Harvest Buddha Bowl With Kale Pesto Dressing,https://tasty.co/recipe/fall-harvest-buddha-bowl-with-kale-pesto-dressing,47,,,,
Winter Vegetable Chili,https://tasty.co/recipe/winter-vegetable-chili,42,,,,
Slow Cooker Vegan Butternut Squash Mac,https://tasty.co/recipe/slow-cooker-vegan-butternut-squash-mac,43,,,,
One-Pot Butternut Squash Pilaf,https://tasty.co/recipe/one-pot-butternut-squash-pilaf,44,,,,
Baked Butternut Squash “Risotto”,https://tasty.co/recipe/baked-butternut-squash-risotto,46,,,,
Whole-roasted Chicken and Veggies,https://tasty.co/recipe/whole-roasted-chicken-and-veggies,50,,,,
Chicken Katsu Tacos,https://tasty.co/recipe/chicken-katsu-tacos,49,,,,
Chicken Bibimbap,https://tasty.co/recipe/chicken-bibimbap,51,,,,
Stir Fry Inspired By Migos,https://tasty.co/recipe/stir-fry-inspired-by-migos,54,,,,
Beer-Battered Shrimp Tacos,https://tasty.co/recipe/beer-battered-shrimp-tacos,61,,,,
Spice-Rubbed Shrimp Tacos,https://tasty.co/recipe/spice-rubbed-shrimp-tacos,53,,,,
Beer-Battered Squash With Ketchup Chip Salt And Spiced Maple Syrup,https://tasty.co/recipe/beer-battered-squash-with-ketchup-chip-salt-and-spiced-maple-syrup,56,,,,
Aries Cake,https://tasty.co/recipe/aries-cake,59,,,,
Classic Red Velvet Cake,https://tasty.co/recipe/classic-red-velvet-cake,64,,,,
Vegan Apple Fritters,https://tasty.co/recipe/vegan-apple-fritters,58,,,,
Korean Seafood Scallion Pancakes,https://tasty.co/recipe/korean-seafood-scallion-pancakes,60,,,,
How To Make Crispy Tempura At Home,https://tasty.co/recipe/how-to-make-crispy-tempura-at-home,68,,,,
Vertical Layered Cookies & Cream Cake,https://tasty.co/recipe/vertical-layered-cookies-cream-cake,66,,,,
Tempura Bowl,https://tasty.co/recipe/tempura-bowl,71,,,,
Double Crunch Shrimp,https://tasty.co/recipe/double-crunch-shrimp,63,,,,
Angel Food Cake In A Springform Pan,https://tasty.co/recipe/angel-food-cake-in-a-springform-pan,65,,,,
Cheese Naan Bread,https://tasty.co/recipe/cheese-naan-bread,62,,,,
Vegan Caesar Salad,https://tasty.co/recipe/vegan-caesar-salad,67,,,,
Mini Muffulettas,https://tasty.co/recipe/mini-muffulettas,69,,,,
How To Make A Fresh Seacuterie Board,https://tasty.co/recipe/how-to-make-a-fresh-seacuterie-board,70,,,,
Summer Chicken Marbella,https://tasty.co/recipe/summer-chicken-marbella,77,,,,
"One-Pot Chicken, Chard, And Couscous Dinner",https://tasty.co/recipe/one-pot-chicken-chard-and-couscous-dinner,74,,,,
Fancy AF Fish Finger Sandwich,https://tasty.co/recipe/fancy-af-fish-finger-sandwich,73,,,,
Ribeye Steaks With Creamy Mustard Sauce As Made By Kiano Moju,https://tasty.co/recipe/ribeye-steaks-with-creamy-mustard-sauce-as-made-by-kiano-moju,88,,,,
Skirt Steak With Mustard Sauce As Made By Katano Kasaine,https://tasty.co/recipe/skirt-steak-with-mustard-sauce-as-made-by-katano-kasaine,87,,,,
Creamy Chicken Piccata,https://tasty.co/recipe/creamy-chicken-piccata,80,,,,
Lamb Biryani,https://tasty.co/recipe/lamb-biryani,82,,,,
Pineapple Carrot Cake Breakfast Bread,https://tasty.co/recipe/pineapple-carrot-cake-breakfast-bread,90,,,,
Sugar Spice Pear Galette,https://tasty.co/recipe/sugar-spice-pear-galette,83,,,,
Berbere Spice Chicken Wings,https://tasty.co/recipe/berbere-spice-chicken-wings,84,,,,
Swedish Saffron Buns (Lussebullar),https://tasty.co/recipe/swedish-saffron-buns-lussebullar,97,,,,
Wakandan Jeweled Vegetable Pilau With Berbere Braised Lamb,https://tasty.co/recipe/wakandan-jeweled-vegetable-pilau-with-berbere-braised-lamb,92,,,,
Gulab Jamun Cake As Made By Hetal Vasavada,https://tasty.co/recipe/gulab-jamun-cake-as-made-by-hetal-vasavada,89,,,,
Easy Chicken Curry With Kanchan Koya,https://tasty.co/recipe/easy-chicken-curry-with-tasty-story-kanchan-koya,93,,,,
Indian-Style Mango Lassi,https://tasty.co/recipe/indian-style-mango-lassi,106,,,,
Mandazi,https://tasty.co/recipe/mandazi,91,,,,
Chai-Spiced Cheesecake Muffins,https://tasty.co/recipe/chai-spiced-cheesecake-muffins,95,,,,
Roasted Eggplant Curry,https://tasty.co/recipe/roasted-eggplant-curry,99,,,,
Homemade Butter Chicken,https://tasty.co/recipe/homemade-butter-chicken,103,,,,
Easy & Healthy Fried Rice,https://tasty.co/recipe/healthier-fried-rice,102,,,,
Chinese Chicken Curry,https://tasty.co/recipe/chinese-chicken-curry,98,,,,
Healthy Carrot Cake Muffins,https://tasty.co/recipe/healthy-carrot-cake-muffins,111,,,,
Classic Carrot Cake,https://tasty.co/recipe/carrot-cake,104,,,,
Cilantro Lime Chicken & Veggie Rice Meal Prep,https://tasty.co/recipe/cilantro-lime-chicken-veggie-rice-meal-prep,108,,,,
Keto Friendly Spinach & Artichoke Chicken Rolls,https://tasty.co/recipe/keto-friendly-spinach-artichoke-chicken-rolls,105,,,,
Cheesy Mashed Cauliflower,https://tasty.co/recipe/cheesy-mashed-cauliflower,113,,,,
Hidden Veggie Mac & Cheese,https://tasty.co/recipe/hidden-veggie-mac-cheese,107,,,,
The Best Ever Cauliflower Pizza Crust,https://tasty.co/recipe/cauliflower-crust-pizza,117,,,,
Low-Carb Mediterranean Chicken And Tomato By Kevin Curry,https://tasty.co/recipe/low-carb-mediterranean-chicken-and-tomato-by-kevin-curry,110,,,,
"Healthy Cauliflower Fried ""Rice""",https://tasty.co/recipe/healthy-cauliflower-fried-rice,112,,,,
Cauliflower Gnocchi,https://tasty.co/recipe/cauliflower-gnocchi,114,,,,
"Uncle Pooh’s Shrimp, Sausage, And Grits",https://tasty.co/recipe/uncle-poohs-shrimp-sausage-and-grits,115,,,,
Quick And Easy Tomato Avocado Melt,https://tasty.co/recipe/quick-and-easy-tomato-avocado-melt,116,,,,
Cajun Shrimp Bake,https://tasty.co/recipe/cajun-shrimp-bake,130,,,,
Chicken Gyros,https://tasty.co/recipe/chicken-gyros,118,,,,
Chili Lime Baked Tilapia With Avocado Crema,https://tasty.co/recipe/chili-lime-baked-tilapia-with-avocado-crema,121,,,,
Homemade Broccoli Cheese Soup,https://tasty.co/recipe/homemade-broccoli-cheese-soup,122,,,,
Buttermilk-Fried Chicken Sandwich,https://tasty.co/recipe/buttermilk-fried-chicken-sandwich,136,,,,
Easy Fish Tacos,https://tasty.co/recipe/easy-fish-tacos,129,,,,
Keto Bacon Cauliflower “Mac” ‘N’ Cheese,https://tasty.co/recipe/keto-bacon-cauliflower-mac-n-cheese,124,,,,
Easy Glazed Pork Chops,https://tasty.co/recipe/easy-glazed-pork-chops,127,,,,
Disneyland's Slow-Cooked Beef Stew Bread Bowl,https://tasty.co/recipe/disneyland-s-slow-cooked-beef-stew-bread-bowl,132,,,,
Summer Potato Salad,https://tasty.co/recipe/summer-potato-salad,126,,,,
Italian-style Bolognese (Ragù),https://tasty.co/recipe/italian-style-bolognese-ragu,133,,,,
Vegan Shepherd’s Pie,https://tasty.co/recipe/vegan-shepherds-pie,134,,,,
Avocado Chicken Salad,https://tasty.co/recipe/avocado-chicken-salad,128,,,,
Slow Cooker Beef Stew,https://tasty.co/recipe/slow-cooker-beef-stew,142,,,,
The Best Crispy Buffalo Wings,https://tasty.co/recipe/the-best-crispy-buffalo-wings,144,,,,
Summer Vegetable Minestrone Soup,https://tasty.co/recipe/summer-vegetable-minestrone-soup,139,,,,
One-pot Chicken Chow Mein,https://tasty.co/recipe/one-pot-chicken-chow-mein,135,,,,
Classic Chicken Noodle Soup,https://tasty.co/recipe/classic-chicken-noodle-soup,138,,,,
Grilled Cheese Roll-ups,https://tasty.co/recipe/grilled-cheese-roll-ups,137,,,,
Cheeseburger Sliders,https://tasty.co/recipe/cheeseburger-sliders,151,,,,
Easy Ravioli “Lasagna”,https://tasty.co/recipe/easy-ravioli-lasagna,140,,,,
Cheesy Chicken Broccoli Bake,https://tasty.co/recipe/cheesy-chicken-broccoli-bake,141,,,,
One Pot Chicken Fajita Pasta,https://tasty.co/recipe/one-pot-chicken-fajita-pasta,143,,,,
Stuffed Chicken Parmesan,https://tasty.co/recipe/stuffed-chicken-parmesan,146,,,,
One-Pot Swedish Meatball Pasta,https://tasty.co/recipe/one-pot-swedish-meatball-pasta,152,,,,
Hasselback Chicken,https://tasty.co/recipe/hasselback-chicken,148,,,,
Easy Chicken Alfredo Penne,https://tasty.co/recipe/easy-chicken-alfredo-penne,149,,,,
One-Pot Lemon Garlic Shrimp Pasta,https://tasty.co/recipe/one-pot-lemon-garlic-shrimp-pasta,153,,,,
One Pot Garlic Parmesan Pasta,https://tasty.co/recipe/one-pot-garlic-parmesan-pasta,156,,,,
Zesty One-Pot Shrimp Pasta,https://tasty.co/recipe/zesty-one-pot-shrimp-pasta,157,,,,
Healthy Fajita-Stuffed Chicken,https://tasty.co/recipe/healthy-fajita-stuffed-chicken,159,,,,
Creamy Lemon Butter Chicken,https://tasty.co/recipe/creamy-lemon-butter-chicken,158,,,,
The Best Ever Vegan Mac ‘N’ Cheese,https://tasty.co/recipe/the-best-ever-vegan-mac-n-cheese,160,,,,
The Best Cheesy Garlic Bread Ever,https://tasty.co/recipe/the-best-cheesy-garlic-bread-ever,171,,,,
Fluffy Pancakes,https://tasty.co/recipe/fluffy-perfect-pancakes,161,,,,
The Best Ever Vegan Brownies,https://tasty.co/recipe/the-best-ever-vegan-brownies,163,,,,
The Best Eggplant Parmesan,https://tasty.co/recipe/the-best-eggplant-parmesan,162,,,,
The Best Ever Vegan Cinnamon Rolls,https://tasty.co/recipe/the-best-ever-vegan-cinnamon-rolls,164,,,,
Scalloped Potato Roll,https://tasty.co/recipe/scalloped-potato-roll,165,,,,
Slow Cooker Beef and Broccoli ,https://tasty.co/recipe/slow-cooker-beef-and-broccoli,167,,,,
Korean-style BBQ Beef,https://tasty.co/recipe/korean-style-bbq-beef,166,,,,
Honey Soy Glazed Salmon,https://tasty.co/recipe/honey-soy-glazed-salmon,168,,,,
Ratatouille,https://tasty.co/recipe/ratatouille,172,,,,
Peanut Butter Energy Bites,https://tasty.co/recipe/peanut-butter-energy-bites,169,,,,
Lemon Chicken And Asparagus Stir-Fry (Under 500 Calories),https://tasty.co/recipe/lemon-chicken-and-asparagus-stir-fry,170,,,,
Healthy Blueberry Banana Bread,https://tasty.co/recipe/healthy-blueberry-banana-bread,173,,,,
Chicken & Veggie Stir-Fry,https://tasty.co/recipe/chicken-veggie-stir-fry,174,,,,
Steak and Avocado Salad,https://tasty.co/recipe/steak-and-avocado-salad,177,,,,
One-Pot Shrimp And Spinach Fettuccine Alfredo Pasta,https://tasty.co/recipe/one-pot-shrimp-and-spinach-pasta,179,,,,
One-Pot Chicken And Mushroom Pasta,https://tasty.co/recipe/one-pot-chicken-and-mushroom-pasta,183,,,,
One-pot Chickpea Curry (Under 300 Calories),https://tasty.co/recipe/one-pot-chickpea-curry,185,,,,
One-Pot Ground Beef Stroganoff,https://tasty.co/recipe/one-pot-ground-beef-stroganoff,180,,,,
Microwave Meal-Prep Lasagna,https://tasty.co/recipe/microwave-meal-prep-lasagna,186,,,,
Meal-Prep Garlic Chicken And Veggie Pasta,https://tasty.co/recipe/meal-prep-garlic-chicken-and-veggie-pasta,184,,,,
Meal Prep Pesto Chicken Pasta,https://tasty.co/recipe/meal-prep-pesto-chicken-pasta,182,,,,
Weekday Meal-prep Pesto Chicken & Veggies,https://tasty.co/recipe/weekday-meal-prep-pesto-chicken-veggies,187,,,,
"Cauliflower ""Potato Salad""",https://tasty.co/recipe/cauliflower-potato-salad,190,,,,
Cloud Bread,https://tasty.co/recipe/cloud-bread,191,,,,
Ham And Egg Breakfast Braid,https://tasty.co/recipe/ham-and-egg-breakfast-braid,194,,,,
Fried Chicken By Marcus Samuelsson,https://tasty.co/recipe/fried-chicken-by-marcus-samuelsson,207,,,,
Slow Cooker Turkey Chili With Cornbread Dumplings,https://tasty.co/recipe/slow-cooker-turkey-chili-with-cornbread-dumplings,199,,,,
Thanksgiving Dip Sandwich,https://tasty.co/recipe/thanksgiving-dip-sandwich,198,,,,
Cinco De Mayo Drink Flight,https://tasty.co/recipe/cinco-de-mayo-drink-flight,196,,,,
Pakistani-Style Veggie Pakoras,https://tasty.co/recipe/pakistani-style-veggie-pakoras,202,,,,
Low-Carb Pad Thai,https://tasty.co/recipe/low-carb-pad-thai,204,,,,
Thai-Style Chicken And Prawn Fried Noodles (Pad Thai),https://tasty.co/recipe/thai-style-chicken-and-prawn-fried-noodles-pad-thai,205,,,,
Classic Pad Thai,https://tasty.co/recipe/classic-pad-thai,209,,,,
Vegan Pad Thai,https://tasty.co/recipe/vegan-pad-thai,203,,,,
Cubano Sliders,https://tasty.co/recipe/cubano-sliders,201,,,,
Pork Cutlet Sliders,https://tasty.co/recipe/pork-cutlet-sliders,206,,,,
Salt-Crusted Beef Tenderloin,https://tasty.co/recipe/salt-crusted-beef-tenderloin,210,,,,
Dijon-Crusted Pork Tenderloin Honey-Glazed Carrots,https://tasty.co/recipe/dijon-crusted-pork-tenderloin-honey-glazed-carrots,219,,,,
Easy One-Pan Pork Tenderloin Dinner With Apples And Onion,https://tasty.co/recipe/easy-one-pan-pork-tenderloin-dinner-with-apples-and-onion,214,,,,
One-Pan Salmon And Veggies,https://tasty.co/recipe/one-pan-salmon-and-veggies,211,,,,
How To Cook A Perfect Risotto,https://tasty.co/recipe/mushroom-risotto,208,,,,
"Cucumber, Tomato, And Avocado Salad",https://tasty.co/recipe/cucumber-tomato-and-avocado-salad,223,,,,
Egg White Breakfast Cups (Under 50 Calories) ,https://tasty.co/recipe/egg-white-breakfast-cups,215,,,,
One-Pot Enchilada Rice,https://tasty.co/recipe/one-pot-enchilada-rice,216,,,,
Zucchini Lasagna,https://tasty.co/recipe/zucchini-lasagna,217,,,,
Monte Cristo Pull-Apart Sliders,https://tasty.co/recipe/monte-cristo-pull-apart-sliders,218,,,,
Mozzarella-Stuffed Turkey Meatloaf,https://tasty.co/recipe/mozzarella-stuffed-turkey-meatloaf,225,,,,
Eggplant Parmesan Boats,https://tasty.co/recipe/eggplant-parmesan-boats,221,,,,
Taco Lasagna,https://tasty.co/recipe/taco-lasagna,220,,,,
Spicy Southwestern-Style Turkey Burgers,https://tasty.co/recipe/spicy-southwestern-style-turkey-burgers,227,,,,
Spaghetti Squash And Meatballs,https://tasty.co/recipe/spaghetti-squash-and-meatballs,226,,,,
Turkey Taco Stuffed Bell Peppers,https://tasty.co/recipe/turkey-taco-stuffed-bell-peppers,224,,,,
North African-style Poached Eggs In Tomato Sauce,https://tasty.co/recipe/north-african-style-poached-eggs-in-tomato-sauce,236,,,,
Lighter Chicken Korma,https://tasty.co/recipe/lighter-chicken-korma,230,,,,
Easy Homemade Chicken Curry,https://tasty.co/recipe/easy-homemade-chicken-curry,229,,,,
Popcorn Fried Chicken (Indian Style),https://tasty.co/recipe/popcorn-fried-chicken-indian-style,237,,,,
One-Pan Spicy Prawns and Rice,https://tasty.co/recipe/one-pan-spicy-prawns-and-rice,238,,,,
Slow Cooker Chicken Tikka Masala,https://tasty.co/recipe/slow-cooker-chicken-tikka-masala,235,,,,
Stuffed French Toast By Chef Andrea Drummer,https://tasty.co/recipe/stuffed-french-toast-by-chef-andrea-drummer,239,,,,
Dairy-Free Vanilla Bean Panna Cotta,https://tasty.co/recipe/dairy-free-vanilla-bean-panna-cotta,246,,,,
Froyo Cookie Sandwiches,https://tasty.co/recipe/froyo-cookie-sandwiches,240,,,,
The Best Vegan Vanilla Ice Cream,https://tasty.co/recipe/the-best-vegan-vanilla-ice-cream,242,,,,
Earl Grey Blackberry Cake,https://tasty.co/recipe/earl-grey-blackberry-cake,244,,,,
Strawberries And Cream Soufflé,https://tasty.co/recipe/strawberries-and-cream-souffle,245,,,,
How To Make A Croquembouche (Cream Puff Tower),https://tasty.co/recipe/croquembouche,247,,,,
Classic Glazed Donuts,https://tasty.co/recipe/classic-glazed-donuts,251,,,,
"Watermelon ""Poke"" Bowl",https://tasty.co/recipe/watermelon-poke-bowl,258,,,,
Gardenscape Focaccia,https://tasty.co/recipe/gardenscape-focaccia,256,,,,
Watermelon Cucumber Cooler,https://tasty.co/recipe/watermelon-cucumber-cooler,254,,,,
Easy Fried Beef Dumplings (Gyoza),https://tasty.co/recipe/easy-fried-beef-dumplings-gyoza,265,,,,
Peri Peri Chicken Feast,https://tasty.co/recipe/peri-peri-chicken-feast,262,,,,
Orange Chicken (Inspired By Panda Express),https://tasty.co/recipe/orange-chicken-inspired-by-panda-express,264,,,,
Beer-battered Onion Rings By Martha Stewart,https://tasty.co/recipe/beer-battered-onion-rings-by-martha-stewart,266,,,,
Wolfgang Puck’s Tomato Risotto With Shrimp,https://tasty.co/recipe/wolfgang-pucks-tomato-risotto-with-shrimp,263,,,,
Cauliflower Shrimp Fried Rice,https://tasty.co/recipe/cauliflower-shrimp-fried-rice,271,,,,
Homemade Big Massive Burger,https://tasty.co/recipe/homemade-big-massive-burger,279,,,,
Original Orange Chicken By Panda Express ,https://tasty.co/recipe/original-orange-chicken-by-panda-express,269,,,,
Brats In A Blanket With Beer Mustard Cheese Sauce,https://tasty.co/recipe/brats-in-a-blanket-with-beer-mustard-cheese-sauce,275,,,,
Pretzels And Beer Cheese Spread,https://tasty.co/recipe/pretzels-and-beer-cheese-spread,270,,,,
Baked Delicata Squash Rings With Honey Mustard Dipping Sauce,https://tasty.co/recipe/baked-delicata-squash-rings-with-honey-mustard-dipping-sauce,268,,,,
Berry French Toast Cups,https://tasty.co/recipe/berry-french-toast-cups,286,,,,
Shrimp Kale Caesar Salad,https://tasty.co/recipe/shrimp-kale-caesar-salad,272,,,,
No-Fuss Breakfast Bake,https://tasty.co/recipe/no-fuss-breakfast-strata,273,,,,
Garlic And Herb Leg Of Lamb With Potatoes,https://tasty.co/recipe/garlic-and-herb-leg-of-lamb-with-potatoes,274,,,,
Easy Foil-Pack Lemon And Rosemary Chicken Dinner,https://tasty.co/recipe/easy-foil-pack-lemon-and-rosemary-chicken-dinner,282,,,,
Garlic Herb Crusted Roast Rack Of Lamb,https://tasty.co/recipe/garlic-herb-crusted-roast-rack-of-lamb,280,,,,
Peanut Noodle Pasta Salad,https://tasty.co/recipe/peanut-noodle-pasta-salad,284,,,,
Healthier Chicken Alfredo Pasta,https://tasty.co/recipe/healthier-chicken-alfredo-pasta,277,,,,
Zucchini Shrimp Scampi,https://tasty.co/recipe/zucchini-shrimp-scampi,276,,,,
Zucchini Noodle Chicken Alfredo,https://tasty.co/recipe/zucchini-noodle-chicken-alfredo,288,,,,
Zucchini Tots,https://tasty.co/recipe/zucchini-tots,281,,,,
Low-Carb Beef Stroganoff,https://tasty.co/recipe/low-carb-beef-stroganoff,283,,,,
Hidden Veggie Chicken & Rice,https://tasty.co/recipe/hidden-veggie-chicken-rice,289,,,,
Hainanese Chicken Rice,https://tasty.co/recipe/hainanese-chicken-rice,294,,,,
Traditional Vietnamese Beef Pho,https://tasty.co/recipe/traditional-vietnamese-beef-pho,303,,,,
Shahi Paneer,https://tasty.co/recipe/ritu-swasti-s-shahi-paneer,291,,,,
Vietnamese Shaking Beef,https://tasty.co/recipe/vietnamese-shaking-beef,293,,,,
Malaysian-style Barbecue Pork Belly (Char Siu Pork),https://tasty.co/recipe/malaysian-style-barbecue-pork-belly-char-siu-pork,295,,,,
Homemade Lumpia,https://tasty.co/recipe/homemade-lumpia,292,,,,
Mexican Carnitas As Made By Claudette Zepeda,https://tasty.co/recipe/mexican-carnitas-as-made-by-claudette,296,,,,
Chilaquiles With Andrea Mares,https://tasty.co/recipe/chilaquiles-with-andrea-mares,298,,,,
Chicken Tinga Tacos (Tinga De Pollo),https://tasty.co/recipe/chicken-tinga-tacos-tinga-de-pollo,305,,,,
Mexican Sopes,https://tasty.co/recipe/mexican-sopes,297,,,,
Slow Cooker Barbacoa-Style Beef Tacos,https://tasty.co/recipe/slow-cooker-barbacoa-style-beef-tacos,307,,,,
Carne Asada by Gabriel Barajas (aka Mr. TacosWay),https://tasty.co/recipe/carne-asada-tacos-way-with-gabriel-barajas-aka-mr-tacosway,309,,,,
2-Layer Tres Leches Cake,https://tasty.co/recipe/2-layer-tres-leches-cake,300,,,,
Enchiladas Verdes Con Pollo As Made By Cuco,https://tasty.co/recipe/enchiladas-verdes-con-pollo-as-made-by-cuco,302,,,,
Shrimp & Avocado Tostadas,https://tasty.co/recipe/shrimp-avocado-tostadas,304,,,,
Tater Tot Breakfast Pizza,https://tasty.co/recipe/tater-tot-breakfast-pizza,313,,,,
Farro Salad With Cucumber And Yogurt-Dill Dressing,https://tasty.co/recipe/farro-salad-with-cucumber-and-yogurt-dill-dressing,308,,,,
Mother’s Day Edible Bouquet,https://tasty.co/recipe/mothers-day-edible-bouquet,310,,,,
Potato-Crusted Quiche,https://tasty.co/recipe/potato-crusted-quiche,314,,,,
Lemon Ricotta Pancakes,https://tasty.co/recipe/lemon-ricotta-pancakes,315,,,,
Slow Cooker Chicken Fajitas,https://tasty.co/recipe/slow-cooker-chicken-fajitas,319,,,,
Spaghetti Squash Stir Fry,https://tasty.co/recipe/spaghetti-squash-stir-fry,321,,,,
Shila’s Grandmother’s Picante De Carne,https://tasty.co/recipe/shilas-grandmothers-picante-de-carne,318,,,,
Chicken Lo Mein,https://tasty.co/recipe/chicken-lo-mein,331,,,,
Sloppy Joe Sliders,https://tasty.co/recipe/sloppy-joe-sliders,326,,,,
Sticky Pineapple Chicken,https://tasty.co/recipe/sticky-pineapple-chicken,325,,,,
Easy Sticky Chicken Drumsticks,https://tasty.co/recipe/easy-sticky-chicken-drumsticks,323,,,,
20-Minute Beef And Broccoli Noodle Stir-Fry,https://tasty.co/recipe/20-minute-beef-and-broccoli-noodle-stir-fry,322,,,,
Sweet & Sour Chicken,https://tasty.co/recipe/sweet-sour-chicken,324,,,,
Sheet Tray Roasted Mushroom Salad,https://tasty.co/recipe/sheet-tray-roasted-mushroom-salad,327,,,,
Falafel And Hummus In A Blender,https://tasty.co/recipe/falafel-and-hummus-in-a-blender,328,,,,
Creamy Tuscan Chicken Rolls,https://tasty.co/recipe/creamy-tuscan-chicken-rolls,329,,,,
Sherry Mushrooms With Creamy Polenta And Gremolata,https://tasty.co/recipe/sherry-mushrooms-with-creamy-polenta-and-gremolata,330,,,,
Vegetarian Pad See Ew,https://tasty.co/recipe/vegetarian-pad-see-ew,334,,,,
Dairy-Free Chicken Fettuccine Alfredo,https://tasty.co/recipe/dairy-free-chicken-fettuccine-alfredo,335,,,,
40-clove Garlic Chicken,https://tasty.co/recipe/40-clove-garlic-chicken,333,,,,
Popcorn Shrimp,https://tasty.co/recipe/popcorn-shrimp,337,,,,
Baked Shrimp Scampi Linguine Pasta,https://tasty.co/recipe/baked-shrimp-scampi-linguine,336,,,,
Under 300-Calorie Honey Lime Shrimp,https://tasty.co/recipe/under-300-calorie-honey-lime-shrimp,340,,,,
Shrimp And Asparagus Stir Fry (Under 300 Calories),https://tasty.co/recipe/shrimp-and-asparagus-stir-fry,344,,,,
Honey Garlic Shrimp Stir-Fry,https://tasty.co/recipe/honey-garlic-shrimp-stir-fry,339,,,,
7-Layer Steak Sandwich,https://tasty.co/recipe/7-layer-steak-sandwich,338,,,,
Steak And Eggs Hash,https://tasty.co/recipe/steak-and-eggs-hash,345,,,,
Beef And Broccoli Stir-Fry,https://tasty.co/recipe/beef-and-broccoli-stir-fry,346,,,,
Skirt Steak With Charred Chimichurri,https://tasty.co/recipe/skirt-steak-with-charred-chimichurri,348,,,,
Garlic And Herb Weeknight Steak Salad,https://tasty.co/recipe/garlic-and-herb-weeknight-steak-salad,347,,,,
Steak And Potato Taco Nachos,https://tasty.co/recipe/steak-and-potato-taco-nachos,352,,,,
3-Way Party Fajitas Kebab,https://tasty.co/recipe/3-way-party-fajitas-kebab,353,,,,
Steak Fajita Quesadillas,https://tasty.co/recipe/steak-fajita-quesadillas,351,,,,
Classic Chocolate Cake,https://tasty.co/recipe/classic-chocolate-cake,354,,,,
Cheesy Potato Casserole,https://tasty.co/recipe/cheesy-potato-casserole,358,,,,
One Skillet Ground Beef Stroganoff,https://tasty.co/recipe/one-skillet-ground-beef-stroganoff,356,,,,
Crispy Potato Tacos,https://tasty.co/recipe/crispy-potato-tacos,362,,,,
The Softest Sugar Cookies Ever,https://tasty.co/recipe/the-softest-sugar-cookies-ever,357,,,,
Spaghetti Squash “Pasta” Meal Prep 2 Ways,https://tasty.co/recipe/spaghetti-squash-pasta-meal-prep-2-ways,361,,,,
Spaghetti Squash And Eggplant Meatballs,https://tasty.co/recipe/spaghetti-squash-and-eggplant-meatballs,359,,,,
Spaghetti Squash Nests,https://tasty.co/recipe/spaghetti-squash-nests,360,,,,
Creamy Lemon Garlic Chicken,https://tasty.co/recipe/creamy-lemon-garlic-chicken,373,,,,
