Recipe Title,Recipe URL,Recipe Video,Cutlery,Container,Glass,
Shrimp Spinach Bacon Alfredo,https://tasty.co/recipe/shrimp-bacon-spinach-alfredo,364,,,,
One-Pot Chicken Spinach Bacon Alfredo,https://tasty.co/recipe/one-pot-chicken-spinach-bacon-alfredo,368,,,,
Sausage and Apple Stuffed Acorn Squash,https://tasty.co/recipe/sausage-and-apple-stuffed-acorn-squash,365,,,,
Chicken Parm-Stuffed Spaghetti Squash,https://tasty.co/recipe/chicken-parmesan-spaghetti-squash,371,,,,
Spaghetti Squash Shrimp Scampi,https://tasty.co/recipe/spaghetti-squash-shrimp-scampi,366,,,,
Sweet Potato Breakfast Boats,https://tasty.co/recipe/sweet-potato-breakfast-boats,367,,,,
Teriyaki Steak Roll-ups,https://tasty.co/recipe/teriyaki-steak-roll-ups,372,,,,
Guinness Short Rib Chili,https://tasty.co/recipe/guinness-short-rib-chili,370,,,,
Spiced Cranberry Mule,https://tasty.co/recipe/spiced-cranberry-mule,369,,,,
Trinidad Black Cake,https://tasty.co/recipe/trinidad-black-cake,380,,,,
Cider Poached Pears,https://tasty.co/recipe/cider-poached-pears,381,,,,
Quick 30-Minute Chicken Pho,https://tasty.co/recipe/quick-30-minute-chicken-pho,378,,,,
Berry Smoothie Bowl,https://tasty.co/recipe/berry-smoothie-bowl,377,,,,
Fluffy Jiggly Japanese Cheesecake,https://tasty.co/recipe/fluffy-jiggly-japanese-cheesecake,382,,,,
Harissa Chicken With Leeks and Potatoes,https://tasty.co/recipe/harissa-chicken-with-leeks-and-potatoes,383,,,,
Middle Eastern Pita Salad (Fattoush Salad),https://tasty.co/recipe/middle-eastern-pita-salad-fattoush-salad,384,,,,
One Pan Chicken And Veggies,https://tasty.co/recipe/one-pan-chicken-and-veggies-1,386,,,,
Sweet Potato Gnocchi,https://tasty.co/recipe/sweet-potato-gnocchi,385,,,,
Leftover Turkey Sandwich,https://tasty.co/recipe/leftover-turkey-sandwich,387,,,,
Mini Strudels 4 Ways,https://tasty.co/recipe/mini-strudels-4-ways,388,,,,
Leftover Ham Sheet Pan Cubanos,https://tasty.co/recipe/leftover-ham-sheet-pan-cubanos,389,,,,
Egg-In-Hole Layered Breakfast Bake,https://tasty.co/recipe/ham-cheese-egg-in-the-hole-layered-bake,392,,,,
Award-Winning Cuban Sandwich By El Cochinito,https://tasty.co/recipe/award-winning-cuban-sandwich-by-el-cochinito,393,,,,
Crispy Baked Chicken Roll,https://tasty.co/recipe/crispy-baked-chicken-roll,398,,,,
Chicken Cordon Bleu Lasagna,https://tasty.co/recipe/chicken-cordon-bleu-lasagna,394,,,,
18-Inches Long Ham And Cheese Swirl Croissant,https://tasty.co/recipe/18-inches-long-ham-and-cheese-swirl-croissant,399,,,,
"Ham, Cheese, And Spinach-stuffed Chicken",https://tasty.co/recipe/ham-cheese-and-spinach-stuffed-chicken,404,,,,
Grilled Cheese “Ravioli”,https://tasty.co/recipe/grilled-cheese-ravioli,395,,,,
Chicken Cordon Bleu Bake,https://tasty.co/recipe/chicken-cordon-bleu-bake,397,,,,
Taco Pizza,https://tasty.co/recipe/taco-pizza,406,,,,
Crunchy Taco Cups,https://tasty.co/recipe/crunchy-taco-cups,405,,,,
Southwest Chicken Alfredo Pasta Bake,https://tasty.co/recipe/southwest-chicken-pasta-bake,401,,,,
Chicken Fajita Quesadillas,https://tasty.co/recipe/chicken-fajita-quesadillas,400,,,,
Slow Cooker Shredded Chicken Tacos,https://tasty.co/recipe/slow-cooker-shredded-tacos,407,,,,
Honey Garlic Chicken Wings,https://tasty.co/recipe/honey-garlic-chicken-wings,402,,,,
Chocolate Pancakes,https://tasty.co/recipe/chocolate-pancakes,419,,,,
Banh Mi Meatball Sandwich,https://tasty.co/recipe/banh-mi-meatball-sandwich,415,,,,
Quinoa Ratatouille-Stuffed Peppers,https://tasty.co/recipe/quinoa-ratatouille-stuffed-peppers,410,,,,
Huevos Ranchero Tortilla Cups,https://tasty.co/recipe/huevos-ranchero-tortilla-cups,411,,,,
Pumpkin Spiced Latte Cinnamon Rolls,https://tasty.co/recipe/pumpkin-spice-latte-rolls,416,,,,
Pumpkin Bread Ring With Maple Cream Cheese Filling,https://tasty.co/recipe/pumpkin-bread-ring-with-maple-cream-cheese-filling,413,,,,
Pumpkin Spice Swiss Roll,https://tasty.co/recipe/pumpkin-spice-swiss-roll,414,,,,
Mini Pumpkin Cheesecake Pies,https://tasty.co/recipe/mini-pumpkin-cheesecake-pies,422,,,,
No Bake Pumpkin Cheesecake,https://tasty.co/recipe/no-bake-pumpkin-cheesecake,417,,,,
Pumpkin Chocolate Chip Whoopie Pies,https://tasty.co/recipe/pumpkin-chocolate-chip-whoopie-pies,428,,,,
Pumpkin Spice Donut Holes,https://tasty.co/recipe/pumpkin-spice-donut-holes,426,,,,
Pumpkin Bread-bottom Cheesecake,https://tasty.co/recipe/pumpkin-bread-bottom-cheesecake,427,,,,
Albondigas (Mexican Meatball Soup),https://tasty.co/recipe/albondigas-mexican-meatball-soup,420,,,,
Double-Decker Steak Breakfast Tacos,https://tasty.co/recipe/double-decker-steak-breakfast-tacos,424,,,,
Crispy Chipotle Rice Balls,https://tasty.co/recipe/crispy-chipotle-rice-balls,421,,,,
Protein-Packed Breakfast Bars,https://tasty.co/recipe/protein-packed-breakfast-bars,423,,,,
Mediterranean Meal Prep,https://tasty.co/recipe/mediterranean-meal-prep,425,,,,
Quinoa Taco-Stuffed Peppers,https://tasty.co/recipe/quinoa-taco-stuffed-peppers,441,,,,
Protein-Packed Buddha Bowl,https://tasty.co/recipe/protein-packed-buddha-bowl,440,,,,
One-Pan Southwestern Chicken Quinoa,https://tasty.co/recipe/one-pan-southwestern-chicken-quinoa,429,,,,
Bibimbap By Chef Esther Choi,https://tasty.co/recipe/bibimbap-by-chef-esther-choi,434,,,,
Honey Lime Grilled Shrimp Salad,https://tasty.co/recipe/honey-lime-grilled-shrimp-salad,432,,,,
How To Make Vegan Kimchi,https://tasty.co/recipe/how-to-make-kimchi,433,,,,
Traditional Chicken Cobb Salad,https://tasty.co/recipe/traditional-chicken-cobb-salad,431,,,,
Vegan Tofu Bao Buns With Pickled Vegetables,https://tasty.co/recipe/vegan-tofu-bao-buns-with-pickled-vegetables,443,,,,
Instant Pot Carnitas,https://tasty.co/recipe/instant-pot-carnitas,438,,,,
Beet And Pear Salad With Lemon Vinaigrette,https://tasty.co/recipe/beet-and-pear-salad-with-lemon-vinaigrette,437,,,,
Cranberry Cream Cheese Braid,https://tasty.co/recipe/cranberry-cream-cheese-braid,444,,,,
Creamed Corn Bake,https://tasty.co/recipe/creamed-corn-bake,439,,,,
Skillet Cornbread,https://tasty.co/recipe/skillet-cornbread,445,,,,
